upstream_key,repository,local_path,commit,commit_date,license_scope,license_evidence,skill_files_total,audit_units,status,notes
ecc-everything-claude-code,https://github.com/affaan-m/everything-claude-code,upstream/ecc-everything-claude-code,ed387446052dfbc6b52de149406b70efa65edc59,2026-07-13T21:31:12-04:00,repository,LICENSE (MIT),797,278,current_upstream_comparison,"Audit uses 278 canonical skills/*/SKILL.md files; 519 localized documentation copies are not separate adoption units."
obra-superpowers,https://github.com/obra/superpowers,upstream/obra-superpowers,d884ae04edebef577e82ff7c4e143debd0bbec99,2026-07-02T14:56:55-07:00,repository,LICENSE (MIT),14,14,candidate,"Review hooks, bootstrap behavior, subagent assumptions, and overlap before adoption."
addyosmani-agent-skills,https://github.com/addyosmani/agent-skills,upstream/addyosmani-agent-skills,5a1b82d6445d1e2f0abeea1072851419a50c0e5c,2026-07-16T23:02:36-07:00,repository,LICENSE (MIT),24,24,candidate,"Lifecycle-oriented skill set; assess overlap with ECC and user-specific task-state rules."
openai-skills,https://github.com/openai/skills,upstream/openai-skills,49f948faa9258a0c61caceaf225e179651397431,2026-06-23T19:36:12-07:00,per_skill,"README.md and each skill LICENSE.txt; mixed Apache, MIT, Figma terms, Notion terms, and other notices",44,44,deprecated_reference_only,"Repository README redirects current examples to openai/plugins; do not bulk-copy or assume one repository-wide license."
openai-plugins,https://github.com/openai/plugins,upstream/openai-plugins,11c74d6ba24d3a6d48f54a194cd00ef3beea18f9,2026-07-13T15:38:40-04:00,per_plugin,"181 of 182 plugin manifests declare a license; values include MIT, Apache-2.0, proprietary, UNLICENSED, Figma terms, and Apache-2.0 AND CC-BY-4.0; 41 license files",608,608,current_primary_reference,"Audit includes every SKILL.md path, including nested platform variants and explicit plugin-eval fixtures; adoption decisions must remain plugin- and skill-specific."
